{
  "version": 1,
  "title": "Lantern task map",
  "source": "examples/sample.json (synthetic)",
  "generatedAt": "2026-09-22 12:00 UTC",
  "kindNames": { "gate": "review" },
  "nodes": [
    { "id": "M0", "kind": "milestone", "label": "M0", "title": "Scaffold", "status": "done", "progress": { "done": 6, "total": 6 } },
    { "id": "M1", "kind": "milestone", "label": "M1", "title": "Accounts and auth", "status": "done", "progress": { "done": 8, "total": 8 } },
    { "id": "M2", "kind": "milestone", "label": "M2", "title": "Offline storage", "status": "done", "progress": { "done": 5, "total": 5 } },
    {
      "id": "M3", "kind": "milestone", "label": "M3", "title": "Sync engine", "status": "progress",
      "progress": { "done": 1, "total": 7, "unit": "tasks" }, "url": "https://example.com/milestones/3", "urlLabel": "milestone 3",
      "sections": [
        { "heading": "Objective", "text": "Two devices editing the same notebook converge without losing an edit, online or off." },
        { "heading": "Done when", "items": ["conflicting edits merge deterministically", "a week offline syncs in under a minute", "sync state is visible in the UI"], "progress": { "done": 1, "total": 3 } }
      ]
    },
    { "id": "M4", "kind": "milestone", "label": "M4", "title": "Sharing", "status": "next", "progress": { "done": 0, "total": 4 } },
    { "id": "M5", "kind": "milestone", "label": "M5", "title": "Search", "status": "todo", "progress": { "done": 0, "total": 5 } },
    { "id": "M6", "kind": "milestone", "label": "M6", "title": "Public beta", "status": "todo", "progress": { "done": 0, "total": 3 } },
    { "id": "M7", "kind": "milestone", "label": "M7", "title": "Desktop app", "status": "todo", "optional": true },

    { "id": "G1", "kind": "gate", "label": "G1", "title": "Security review", "status": "done", "detail": "after M1" },
    {
      "id": "G2", "kind": "gate", "label": "G2", "title": "Beta readiness review", "status": "todo", "detail": "after M3, M4, M5",
      "sections": [
        { "heading": "Questions", "items": ["Can a user lose data in any sync path we ship?", "Is every error state reachable from the UI recoverable without support?"] },
        { "heading": "Owner", "text": "Platform team" }
      ]
    },

    { "id": "T-11", "kind": "task", "label": "T-11", "title": "Email and password sign-in", "status": "done", "parent": "M1" },
    { "id": "T-12", "kind": "task", "label": "T-12", "title": "Session refresh", "status": "done", "parent": "M1" },
    { "id": "T-21", "kind": "task", "label": "T-21", "title": "IndexedDB store with migrations", "status": "done", "parent": "M2" },
    { "id": "T-31", "kind": "task", "label": "T-31", "title": "Change log table", "status": "done", "parent": "M3" },
    {
      "id": "T-32", "kind": "task", "label": "T-32", "title": "Conflict resolver", "status": "review", "parent": "M3", "detail": "PR #212",
      "url": "https://example.com/pulls/212", "urlLabel": "PR #212",
      "sections": [{ "heading": "Reviewers", "text": "2 of 2 requested, 1 approved" }]
    },
    { "id": "T-33", "kind": "task", "label": "T-33", "title": "Background sync worker", "status": "failed", "parent": "M3", "detail": "integration-tests" },
    { "id": "T-34", "kind": "task", "label": "T-34", "title": "Retry with exponential backoff", "status": "gate", "parent": "M3", "detail": "e2e running" },
    { "id": "T-35", "kind": "task", "label": "T-35", "title": "Sync status indicator", "status": "next", "queued": true, "parent": "M3", "detail": "not started" },
    { "id": "T-36", "kind": "task", "label": "T-36", "title": "Tombstone compaction", "status": "todo", "parent": "M3" },
    { "id": "T-37", "kind": "task", "label": "T-37", "title": "Load test a week of offline edits", "status": "blocked", "parent": "M3", "detail": "needs staging db" },
    { "id": "T-38", "kind": "task", "label": "T-38", "title": "Sync telemetry", "status": "progress", "parent": "M3", "detail": "draft" },
    { "id": "T-41", "kind": "task", "label": "T-41", "title": "Share link model", "status": "next", "queued": true, "parent": "M4", "detail": "not started" },
    { "id": "T-42", "kind": "task", "label": "T-42", "title": "Invite emails", "status": "todo", "parent": "M4" },

    {
      "id": "I-90", "kind": "issue", "label": "#90", "title": "Edits made offline for more than 24h are dropped on sync", "status": "open",
      "parent": "M3", "tags": ["bug"],
      "links": [
        { "to": "M3", "why": "filed against this milestone", "strong": true },
        { "to": "M2", "why": "body mentions the offline store", "strong": false }
      ]
    },
    { "id": "I-91", "kind": "issue", "label": "#91", "title": "Password reset email lands in spam", "status": "open", "parent": "M1", "tags": ["bug"] },
    { "id": "I-94", "kind": "issue", "label": "#94", "title": "Session tokens were not rotated on password change", "status": "done", "parent": "G1", "tags": ["security"] },
    {
      "id": "I-92", "kind": "issue", "label": "#92", "title": "Decide on a search index library", "status": "open", "tags": ["decision"],
      "links": [
        { "to": "M5", "why": "named in the title of the planning thread", "strong": true },
        { "to": "M7", "why": "desktop would share the index", "strong": false }
      ]
    },
    { "id": "I-93", "kind": "issue", "label": "#93", "title": "Contributor guide still describes the old build", "status": "open", "tags": ["docs"] }
  ],
  "edges": [
    { "from": "M0", "to": "M1", "type": "dep" },
    { "from": "M0", "to": "M2", "type": "dep" },
    { "from": "M1", "to": "M3", "type": "dep" },
    { "from": "M2", "to": "M3", "type": "dep" },
    { "from": "M1", "to": "M4", "type": "dep" },
    { "from": "M3", "to": "M5", "type": "dep" },
    { "from": "M3", "to": "M6", "type": "dep" },
    { "from": "M4", "to": "M6", "type": "dep" },
    { "from": "M5", "to": "M6", "type": "dep" },
    { "from": "M3", "to": "M7", "type": "dep" },
    { "from": "M1", "to": "G1", "type": "gate" },
    { "from": "G1", "to": "M4", "type": "advisory" },
    { "from": "M3", "to": "G2", "type": "gate" },
    { "from": "M4", "to": "G2", "type": "gate" },
    { "from": "M5", "to": "G2", "type": "gate" },
    { "from": "G2", "to": "M6", "type": "advisory" },
    { "from": "T-31", "to": "T-32", "type": "dep" },
    { "from": "T-31", "to": "T-33", "type": "dep" },
    { "from": "T-33", "to": "T-34", "type": "dep" },
    { "from": "T-33", "to": "T-36", "type": "dep" },
    { "from": "T-41", "to": "T-42", "type": "dep" },
    { "from": "I-90", "to": "T-33", "type": "resolves" }
  ]
}
